{
  "claim_boundary": "Waveform compatibility only; no mass, internal-orbit, transparent-shell, prevalence, or shell-mass inference.",
  "date": "2026-08-17",
  "implementation_id": "DERD-v0.9-phase09-claim-grade-development-cohort",
  "manifest_id": "PHASE09-CLAIM-GRADE-MULTIFAMILY-DEVELOPMENT-COHORT-V1",
  "protocol_id": "DERD-PHASE09-CLAIM-GRADE-MULTIFAMILY-DEVELOPMENT-1.0",
  "protocol_sha256": "25642d29d8e72e8fde54767151c6c824c64f08175a5681aeb9cfcacdc86fd6e5",
  "raw_bytes_bundling_policy": "EXCLUDED_FROM_RELEASE; RETRIEVAL SCRIPT AND DIGEST RECEIPTS ONLY",
  "rights_status": "OGLE ATTRIBUTION REQUIRED; MIRROR REDISTRIBUTION TERMS NOT INDEPENDENTLY VERIFIED",
  "selection_rule": "Five declared exposed-development identities per family, chosen before Phase-09 score inspection. No identity may enter a pristine holdout.",
  "status": "FROZEN_EXPOSED_DEVELOPMENT_COHORT_EXECUTION_REQUIRES_SOURCE_AND_METADATA_GATES",
  "targets": [
    {
      "catalog_period_days": 3.118149,
      "evidence_role": "exposed-development-only",
      "family": "classical_cepheid",
      "inherited_phase08": {
        "canonical_target_record_sha256": "3552db199b811aa22508643def09e1948e952dba22963209af15689f7d3a415f",
        "exchange_relative_path": "artifacts/phase08/harmonic_exchange/OGLE-LMC-CEP-0002.json",
        "exchange_sha256": "93570ddc7ee47f9c176d54b8aa2c6a658bbd17ac7768af26c131320beb0acbcc",
        "phase08_disposition": "ABSTAIN_INSUFFICIENT_RECOVERY_HARMONIC_SIGNAL",
        "phase08_stage_reached": "RECOVERY_HARMONICS",
        "summary_relative_path": "artifacts/phase08/phase08_summary.json"
      },
      "metadata_identity_status": "RESOLVED_EXACT",
      "mode": "F",
      "mode_evidence_grade": "EXTERNAL_CATALOG_MIRROR",
      "object_id": "OGLE-LMC-CEP-0002",
      "period_evidence_grade": "EXTERNAL_CATALOG_MIRROR",
      "period_source": "dubbatee/ScienceExtensionCode@2d5f05d5c20d8c4c1c1e8811d502398232f14316",
      "source_byte_count": 8784,
      "source_commit": "55836b58345b9507bfbd98c5fabbac82c83605e3",
      "source_git_blob_sha1": "1602e53ada1ee586b6a9c7c0b7b09f4c967c144d",
      "source_observation_count": 366,
      "source_relative_path": "data/raw/phase09_cohort/OGLE-LMC-CEP-0002.complete.dat",
      "source_repository": "bksim/OutlierDetection",
      "source_repository_path": "Cluster/cep/phot/I/OGLE-LMC-CEP-0002.dat",
      "source_sha256": "65fba2e0da1b6ecc213d5f485bb20a2fb7793971a8065c09506ac5632ca630a8",
      "source_sha256_status": "FROZEN"
    },
    {
      "catalog_period_days": 2.2296385,
      "evidence_role": "exposed-development-only",
      "family": "classical_cepheid",
      "inherited_phase08": null,
      "metadata_identity_status": "RESOLVED_EXACT",
      "mode": "1O",
      "mode_evidence_grade": "EXTERNAL_CATALOG_MIRROR",
      "object_id": "OGLE-LMC-CEP-0004",
      "period_evidence_grade": "EXTERNAL_CATALOG_MIRROR",
      "period_source": "dubbatee/ScienceExtensionCode@2d5f05d5c20d8c4c1c1e8811d502398232f14316",
      "source_byte_count": 8808,
      "source_commit": "55836b58345b9507bfbd98c5fabbac82c83605e3",
      "source_git_blob_sha1": "12ba4fb6df56ade0f191307c1d7c0ebaa0f563dd",
      "source_observation_count": 367,
      "source_relative_path": "data/raw/phase09_cohort/OGLE-LMC-CEP-0004.complete.dat",
      "source_repository": "bksim/OutlierDetection",
      "source_repository_path": "Cluster/cep/phot/I/OGLE-LMC-CEP-0004.dat",
      "source_sha256": null,
      "source_sha256_status": "PENDING_ACQUISITION_RECEIPT"
    },
    {
      "catalog_period_days": 5.6119491,
      "evidence_role": "exposed-development-only",
      "family": "classical_cepheid",
      "inherited_phase08": null,
      "metadata_identity_status": "RESOLVED_EXACT",
      "mode": "F",
      "mode_evidence_grade": "EXTERNAL_CATALOG_MIRROR",
      "object_id": "OGLE-LMC-CEP-0005",
      "period_evidence_grade": "EXTERNAL_CATALOG_MIRROR",
      "period_source": "dubbatee/ScienceExtensionCode@2d5f05d5c20d8c4c1c1e8811d502398232f14316",
      "source_byte_count": 8808,
      "source_commit": "55836b58345b9507bfbd98c5fabbac82c83605e3",
      "source_git_blob_sha1": "889b8f84a98b545956f99adf234ac079f2ee4c8a",
      "source_observation_count": 367,
      "source_relative_path": "data/raw/phase09_cohort/OGLE-LMC-CEP-0005.complete.dat",
      "source_repository": "bksim/OutlierDetection",
      "source_repository_path": "Cluster/cep/phot/I/OGLE-LMC-CEP-0005.dat",
      "source_sha256": null,
      "source_sha256_status": "PENDING_ACQUISITION_RECEIPT"
    },
    {
      "catalog_period_days": 3.2947501,
      "evidence_role": "exposed-development-only",
      "family": "classical_cepheid",
      "inherited_phase08": null,
      "metadata_identity_status": "RESOLVED_EXACT",
      "mode": "1O",
      "mode_evidence_grade": "EXTERNAL_CATALOG_MIRROR",
      "object_id": "OGLE-LMC-CEP-0006",
      "period_evidence_grade": "EXTERNAL_CATALOG_MIRROR",
      "period_source": "dubbatee/ScienceExtensionCode@2d5f05d5c20d8c4c1c1e8811d502398232f14316",
      "source_byte_count": 16584,
      "source_commit": "55836b58345b9507bfbd98c5fabbac82c83605e3",
      "source_git_blob_sha1": "74a2794a59a5cc2c9fd462e7347342bafc1b0a96",
      "source_observation_count": 691,
      "source_relative_path": "data/raw/phase09_cohort/OGLE-LMC-CEP-0006.complete.dat",
      "source_repository": "bksim/OutlierDetection",
      "source_repository_path": "Cluster/cep/phot/I/OGLE-LMC-CEP-0006.dat",
      "source_sha256": null,
      "source_sha256_status": "PENDING_ACQUISITION_RECEIPT"
    },
    {
      "catalog_period_days": 2.5655853,
      "evidence_role": "exposed-development-only",
      "family": "classical_cepheid",
      "inherited_phase08": {
        "canonical_target_record_sha256": "fe7d7cb579346d597790b9258259ca3b41b022b4ae1c3040c6eaa8ad20904f6b",
        "exchange_relative_path": "artifacts/phase08/harmonic_exchange/OGLE-LMC-CEP-0010.json",
        "exchange_sha256": "84f1089012721da639ed59fd5f454fd27443bf9d64d165e88827ca7c58c5ba78",
        "phase08_disposition": "ABSTAIN_INSUFFICIENT_RECOVERY_HARMONIC_SIGNAL",
        "phase08_stage_reached": "RECOVERY_HARMONICS",
        "summary_relative_path": "artifacts/phase08/phase08_summary.json"
      },
      "metadata_identity_status": "RESOLVED_EXACT",
      "mode": "1O",
      "mode_evidence_grade": "EXTERNAL_CATALOG_MIRROR",
      "object_id": "OGLE-LMC-CEP-0010",
      "period_evidence_grade": "EXTERNAL_CATALOG_MIRROR",
      "period_source": "dubbatee/ScienceExtensionCode@2d5f05d5c20d8c4c1c1e8811d502398232f14316",
      "source_byte_count": 8928,
      "source_commit": "55836b58345b9507bfbd98c5fabbac82c83605e3",
      "source_git_blob_sha1": "fd82c05bb3a62ba9a8c614ac51eb315124090381",
      "source_observation_count": 372,
      "source_relative_path": "data/raw/phase09_cohort/OGLE-LMC-CEP-0010.complete.dat",
      "source_repository": "bksim/OutlierDetection",
      "source_repository_path": "Cluster/cep/phot/I/OGLE-LMC-CEP-0010.dat",
      "source_sha256": "574d7252996f5ee71169a97f2d7b52a8acbdb0898df65a7b61f5419ae9f063e0",
      "source_sha256_status": "FROZEN"
    },
    {
      "catalog_period_days": 0.6347522,
      "evidence_role": "exposed-development-only",
      "family": "rr_lyrae",
      "inherited_phase08": {
        "canonical_target_record_sha256": "e8e20f92295810dd3b97fcb107b8815c86f07c1d3e2887efdd93f4f0ccf68cca",
        "exchange_relative_path": "artifacts/phase08/harmonic_exchange/OGLE-LMC-RRLYR-00001.json",
        "exchange_sha256": "fd3b473755833fe0ec1134ee97151f0a6349e53aec07c3623a710f2a58b4bf45",
        "phase08_disposition": "ABSTAIN_INSUFFICIENT_MEASURED_FORECAST_HARMONICS",
        "phase08_stage_reached": "FORECAST_HARMONICS",
        "summary_relative_path": "artifacts/phase08/phase08_summary.json"
      },
      "metadata_identity_status": "RESOLVED_EXACT",
      "mode": "RRab",
      "mode_evidence_grade": "EXTERNAL_CATALOG_CROSSCHECK",
      "object_id": "OGLE-LMC-RRLYR-00001",
      "period_evidence_grade": "EXTERNAL_CATALOG_CROSSCHECK",
      "period_source": "OGLE LMC RR Lyrae catalog cross-check",
      "source_byte_count": 7968,
      "source_commit": "55836b58345b9507bfbd98c5fabbac82c83605e3",
      "source_git_blob_sha1": "526305a302055b946fb274b75a06d086b1cd917b",
      "source_observation_count": 332,
      "source_relative_path": "data/raw/phase09_cohort/OGLE-LMC-RRLYR-00001.complete.dat",
      "source_repository": "bksim/OutlierDetection",
      "source_repository_path": "Cluster/rrlyr/phot/I/OGLE-LMC-RRLYR-00001.dat",
      "source_sha256": "798e885aa64d3fa2827b165239cccf5463794735ec82a891d52c242cb4d2eb6a",
      "source_sha256_status": "FROZEN"
    },
    {
      "catalog_period_days": 0.6564971,
      "evidence_role": "exposed-development-only",
      "family": "rr_lyrae",
      "inherited_phase08": null,
      "metadata_identity_status": "RESOLVED_EXACT",
      "mode": "RRab",
      "mode_evidence_grade": "EXTERNAL_CATALOG_CROSSCHECK",
      "object_id": "OGLE-LMC-RRLYR-00003",
      "period_evidence_grade": "EXTERNAL_CATALOG_CROSSCHECK",
      "period_source": "OGLE LMC RR Lyrae catalog cross-check",
      "source_byte_count": 8640,
      "source_commit": "55836b58345b9507bfbd98c5fabbac82c83605e3",
      "source_git_blob_sha1": "359bb27d29966291ace5b23ff93aa506dafd157f",
      "source_observation_count": 360,
      "source_relative_path": "data/raw/phase09_cohort/OGLE-LMC-RRLYR-00003.complete.dat",
      "source_repository": "bksim/OutlierDetection",
      "source_repository_path": "Cluster/rrlyr/phot/I/OGLE-LMC-RRLYR-00003.dat",
      "source_sha256": null,
      "source_sha256_status": "PENDING_ACQUISITION_RECEIPT"
    },
    {
      "catalog_period_days": 0.5123745,
      "evidence_role": "exposed-development-only",
      "family": "rr_lyrae",
      "inherited_phase08": {
        "canonical_target_record_sha256": "ee40e227ce73994b8519b3739a11f18d88bb769813e09a7d9797d5c79130c56b",